{
  "provider": "helius",
  "transport": "fixture",
  "notification_id": "fixture-trade-001",
  "received_at": "2026-10-13T01:00:03Z",
  "commitment": "confirmed",
  "slot": 300000002,
  "signature": "4xSKzM8bvpudE521jikHqASzMr23Ms4X4ieY3K8oFPFrJWCSSgYocJmHznrR8b12voDxKDH8ykdCLXSRrx6duVLH",
  "raw_payload_sha256": "1111111111111111111111111111111111111111111111111111111111111111",
  "idl_revision": "fixture-pump-idl-1",
  "raw_payload": {
    "program": "pump",
    "eventName": "TradeEvent",
    "decoded": {
      "mint": "7LSsEoJGhLeZzGvDofTdNg7M3JttxQqGWNLo6vWMpump",
      "sol_amount": "10000000",
      "token_amount": "35000000000",
      "is_buy": true,
      "user": "9XDYTfQKwW8sHPqnFdUreMmtmffmkHVPGTNV2e3LKxNW",
      "timestamp": 1791853203,
      "virtual_sol_reserves": "30010000000",
      "virtual_token_reserves": "1072965000000000",
      "real_sol_reserves": "10000000",
      "real_token_reserves": "793065000000000",
      "fee": "100000",
      "fee_basis_points": "100",
      "creator": "5L5k7gtGnGnLQR6sdH7YkqFTAA7VwTfYFaZ6EhEsU3saCX",
      "creator_fee_basis_points": "0",
      "creator_fee": "0",
      "quote_mint": "So11111111111111111111111111111111111111112",
      "virtual_quote_reserves": "0",
      "real_quote_reserves": "10000000",
      "ix_name": "buy"
    }
  }
}
